,INDICATOR_CODE,INDICATOR_NAME,SOURCE_NOTE,SOURCE_ORGANIZATION
0,SH.STA.WASH.P5,,,
1,SH.STA.SMSS.ZS,,,
2,SH.STA.SMSS.UR.ZS,,,
3,SH.STA.SMSS.RU.ZS,,,
4,SH.STA.POIS.P5.MA,,,
5,SH.STA.POIS.P5.FE,,,
6,SH.STA.POIS.P5,,,
7,SH.STA.ODFC.ZS,Personas que practican la defecación al aire libre (% de la población),"People practicing open defecation refers to the percentage of the population defecating in the open, such as in fields, forest, bushes, open bodies of water, on beaches, in other open spaces or disposed of with solid waste.",Programa Conjunto de Vigilancia de la OMS y Unicef para el Abastecimiento de Agua y el Saneamiento (http://www.wssinfo.org/).
8,SH.STA.ODFC.UR.ZS,"Personas que practican la defecación al aire libre, sector urbano (% de la población urbana)","People practicing open defecation refers to the percentage of the population defecating in the open, such as in fields, forest, bushes, open bodies of water, on beaches, in other open spaces or disposed of with solid waste.",Programa Conjunto de Vigilancia de la OMS y Unicef para el Abastecimiento de Agua y el Saneamiento (http://www.wssinfo.org/).
9,SH.STA.ODFC.RU.ZS,"Personas que practican la defecación al aire libre, sector rural (% de la población rural)","People practicing open defecation refers to the percentage of the population defecating in the open, such as in fields, forest, bushes, open bodies of water, on beaches, in other open spaces or disposed of with solid waste.",WHO/UNICEF Joint Monitoring Programme (JMP) for Water Supply and Sanitation (http://www.wssinfo.org/).
10,SH.STA.HYGN.ZS,,,
11,SH.STA.HYGN.UR.ZS,,,
12,SH.STA.HYGN.RU.ZS,,,
13,SH.STA.BASS.ZS,,,
14,SH.STA.BASS.UR.ZS,,,
15,SH.STA.BASS.RU.ZS,,,
16,SH.STA.AIRP.P5,,,
17,SH.H2O.SMDW.ZS,,,
18,SH.H2O.SMDW.UR.ZS,,,
19,SH.H2O.SMDW.RU.ZS,,,
20,SH.H2O.BASW.ZS,,,
21,SH.H2O.BASW.UR.ZS,,,
22,SH.H2O.BASW.RU.ZS,,,
23,NY.GDP.TOTL.RT.ZS,Rentas totales de los recursos naturales (% del PIB),"La renta total de los recursos naturales es la suma de la renta del petróleo, la renta del gas natural, la renta del carbón (duro y blando), la renta mineral y la renta forestal.","Los cálculos se basan en fuentes y métodos descritos en ""The Changing Wealth of Nations: Measuring Sustainable Development in the New Millennium"" (La riqueza variable de las naciones: Medición del desarrollo sostenible en el nuevo milenio) (Banco Mundial, 2011)."
24,NY.GDP.PETR.RT.ZS,Rentas del petróleo (% del PIB),La renta del petróleo es la diferencia entre el valor de la producción de petróleo crudo a precios mundiales y los costos totales de producción.,"Los cálculos se basan en fuentes y métodos descritos en ""The Changing Wealth of Nations: Measuring Sustainable Development in the New Millennium"" (La riqueza variable de las naciones: Medición del desarrollo sostenible en el nuevo milenio) (Banco Mundial, 2011)."
25,NY.GDP.NGAS.RT.ZS,Renta del gas natural (% del PIB),La renta de gas natural es la diferencia entre el valor de la producción de gas natural a precios mundiales y los costos totales de producción.,"Los cálculos se basan en fuentes y métodos descritos en ""The Changing Wealth of Nations: Measuring Sustainable Development in the New Millennium"" (La riqueza variable de las naciones: Medición del desarrollo sostenible en el nuevo milenio) (Banco Mundial, 2011)."
26,NY.GDP.MINR.RT.ZS,Rentas mineras  (% del PIB),"La renta del mineral es la diferencia entre el valor de producción para la existencia de minerales a precios mundiales y su costo total de producción. Los minerales que se incluyen en el cálculo son estaño, oro, plomo, zinc, hierro, cobre, níquel, plata, bauxita y fosfato.","Los cálculos se basan en fuentes y métodos descritos en ""The Changing Wealth of Nations: Measuring Sustainable Development in the New Millennium"" (La riqueza variable de las naciones: Medición del desarrollo sostenible en el nuevo milenio) (Banco Mundial, 2011)."
27,NY.GDP.FRST.RT.ZS,Rentas forestales (% del PIB),La renta forestal es la cosecha de madera en rollo multiplicada por el producto de los precios promedio y una tarifa específica para cada región.,"Los cálculos se basan en fuentes y métodos descritos en ""The Changing Wealth of Nations: Measuring Sustainable Development in the New Millennium"" (La riqueza variable de las naciones: Medición del desarrollo sostenible en el nuevo milenio) (Banco Mundial, 2011)."
28,NY.GDP.COAL.RT.ZS,Rentas del carbón (% del PIB),Las rentas del carbón representan la diferencia entre el valor de la producción de carbón duro y blando a precios mundiales y su costo total de producción.,"Los cálculos se basan en fuentes y métodos descritos en ""The Changing Wealth of Nations: Measuring Sustainable Development in the New Millennium"" (La riqueza variable de las naciones: Medición del desarrollo sostenible en el nuevo milenio) (Banco Mundial, 2011)."
29,NY.ADJ.SVNX.GN.ZS,"Ahorro neto ajustado, excluido el daño por emisión de partículas (% del ingreso nacional bruto: INB)","El ahorro neto ajustado equivale al ahorro nacional neto más el gasto en educación y menos el agotamiento de fuentes de energía, el agotamiento de minerales, el agotamiento neto de recursos forestales, y la emisión de dióxido de carbono. Esta serie excluye el daño por emisiones de partículas.","Cálculos del personal del Banco Mundial basados en fuentes y métodos que aparecen en la publicación del Banco Mundial ""The Changing Wealth of Nations: Measuring Sustainable Development in the New Millennium"" (La riqueza variable de las naciones: Medición del desarrollo sostenible en el nuevo milenio) (2011)."
30,NY.ADJ.SVNX.CD,"Ahorro neto ajustado, excluido el daño por emisión de partículas (US$ actuales)","El ahorro neto ajustado equivale al ahorro nacional neto más el gasto en educación y menos el agotamiento de fuentes de energía, el agotamiento de minerales, el agotamiento neto de recursos forestales, y la emisión de dióxido de carbono. Esta serie excluye el daño por emisiones de partículas.","Cálculos del personal del Banco Mundial basados en fuentes y métodos que aparecen en la publicación del Banco Mundial ""The Changing Wealth of Nations: Measuring Sustainable Development in the New Millennium"" (La riqueza variable de las naciones: Medición del desarrollo sostenible en el nuevo milenio) (2011)."
31,NY.ADJ.SVNG.GN.ZS,"Ahorro neto ajustado, incluido el daño por emisión de partículas (% del INB)","El ahorro neto ajustado es igual al ahorro nacional neto más el gasto en educación y menos el agotamiento de fuentes de energía, el agotamiento de minerales, el agotamiento neto de recursos forestales, y el daño por emisiones de partículas y de dióxido de carbono.","Cálculos del personal del Banco Mundial basados en fuentes y métodos que aparecen en la publicación del Banco Mundial ""The Changing Wealth of Nations: Measuring Sustainable Development in the New Millennium"" (La riqueza variable de las naciones: Medición del desarrollo sostenible en el nuevo milenio) (2011)."
32,NY.ADJ.SVNG.CD," Ahorro neto ajustado, incluido el daño por emisión de partículas (US$ actuales)","El ahorro neto ajustado es igual al ahorro nacional neto más el gasto en educación y menos el agotamiento de fuentes de energía, el agotamiento de minerales, el agotamiento neto de recursos forestales, y el daño por emisiones de partículas y de dióxido de carbono.","Cálculos del personal del Banco Mundial basados en fuentes y métodos que aparecen en la publicación del Banco Mundial ""The Changing Wealth of Nations: Measuring Sustainable Development in the New Millennium"" (La riqueza variable de las naciones: Medición del desarrollo sostenible en el nuevo milenio) (2011)."
33,NY.ADJ.NNAT.GN.ZS,Ahorro ajustado: ahorro nacional neto (% del INB),El ahorro nacional neto es igual al ahorro nacional bruto menos el valor del consumo de capital fijo.,"Cálculos del personal del Banco Mundial basados en fuentes y métodos que aparecen en la publicación del Banco Mundial ""The Changing Wealth of Nations: Measuring Sustainable Development in the New Millennium"" (La riqueza variable de las naciones: Medición del desarrollo sostenible en el nuevo milenio) (2011)."
34,NY.ADJ.NNAT.CD,Ahorro ajustado: ahorro nacional neto (US$ actuales),El ahorro nacional neto es igual al ahorro nacional bruto menos el valor del consumo de capital fijo.,"Cálculos del personal del Banco Mundial basados en fuentes y métodos que aparecen en la publicación del Banco Mundial ""The Changing Wealth of Nations: Measuring Sustainable Development in the New Millennium"" (La riqueza variable de las naciones: Medición del desarrollo sostenible en el nuevo milenio) (2011)."
35,NY.ADJ.ICTR.GN.ZS,Ahorro ajustado: ahorro bruto (% del INB),"El ahorro bruto es la diferencia entre el ingreso nacional bruto y el consumo público y privado, más las transferencias corrientes netas.",Archivos de datos sobre las cuentas nacionales del Banco Mundial.
36,NY.ADJ.DPEM.GN.ZS,Ahorro ajustado: daño por emisión de partículas (% del INB),"Particulate emissions damage is the damage due to exposure of a countrys population to ambient concentrations of particulates measuring less than 2.5 microns in diameter (PM2.5), ambient ozone pollution, and indoor concentrations of PM2.5 in households cooking with solid fuels. Damages are calculated as foregone labor income due to premature death. Estimates of health impacts from the Global Burden of Disease Study 2013 are for 1990, 1995, 2000, 2005, 2010, and 2013. Data for other years have been extrapolated from trends in mortality rates.","Los datos sobre los efectos en la salud provocados por la exposición a la contaminación ambiental por PM2,5 y la contaminación del aire en el interior de las viviendas se obtuvieron del Estudio sobre la Carga Mundial de Morbilidad 2013. Los datos son proporcionados por el Instituto para la Medición y Evaluación de la Salud en la Universidad de Washington."
37,NY.ADJ.DPEM.CD,Ahorro ajustado: daño por emisión de partículas (US$ actuales),"Particulate emissions damage is the damage due to exposure of a countrys population to ambient concentrations of particulates measuring less than 2.5 microns in diameter (PM2.5), ambient ozone pollution, and indoor concentrations of PM2.5 in households cooking with solid fuels. Damages are calculated as foregone labor income due to premature death. Estimates of health impacts from the Global Burden of Disease Study 2013 are for 1990, 1995, 2000, 2005, 2010, and 2013. Data for other years have been extrapolated from trends in mortality rates.","Los datos sobre los efectos en la salud provocados por la exposición a la contaminación ambiental por PM2,5 y la contaminación del aire en el interior de las viviendas se obtuvieron del Estudio sobre la Carga Mundial de Morbilidad 2013. Los datos son proporcionados por el Instituto para la Medición y Evaluación de la Salud en la Universidad de Washington."
38,NY.ADJ.DNGY.GN.ZS,Ahorro ajustado: agotamiento de fuentes de energía (% del INB),"El agotamiento de fuentes de energía equivale al producto de la renta unitaria de los recursos y las cantidades físicas de la energía extraída. Comprende petróleo crudo, gas natural y carbón. ","Cálculos del personal del Banco Mundial basados en fuentes y métodos que aparecen en la publicación del Banco Mundial ""The Changing Wealth of Nations: Measuring Sustainable Development in the New Millennium"" (La riqueza variable de las naciones: Medición del desarrollo sostenible en el nuevo milenio) (2011)."
39,NY.ADJ.DNGY.CD,Ahorro ajustado: agotamiento de fuentes de energía (US$ actuales),"El agotamiento de fuentes de energía equivale al producto de la renta unitaria de los recursos y las cantidades físicas de la energía extraída. Comprende petróleo crudo, gas natural y carbón. ","Cálculos del personal del Banco Mundial basados en fuentes y métodos que aparecen en la publicación del Banco Mundial ""The Changing Wealth of Nations: Measuring Sustainable Development in the New Millennium"" (La riqueza variable de las naciones: Medición del desarrollo sostenible en el nuevo milenio) (2011)."
40,NY.ADJ.DMIN.GN.ZS,Ahorro ajustado: agotamiento de minerales (% del INB),"El agotamiento de minerales es igual al producto de la renta unitaria de los recursos y las cantidades físicas de los minerales extraídos. Comprende bauxita, cobre, hierro, plomo, níquel, fosfato, latón, zinc, oro y plata. ","Cálculos del personal del Banco Mundial basados en fuentes y métodos que aparecen en la publicación del Banco Mundial ""The Changing Wealth of Nations: Measuring Sustainable Development in the New Millennium"" (La riqueza variable de las naciones: Medición del desarrollo sostenible en el nuevo milenio) (2011)."
41,NY.ADJ.DMIN.CD,Ahorro ajustado: agotamiento de minerales (US$ actuales),"El agotamiento de minerales es igual al producto de la renta unitaria de los recursos y las cantidades físicas de los minerales extraídos. Comprende bauxita, cobre, hierro, plomo, níquel, fosfato, latón, zinc, oro y plata. ","Cálculos del personal del Banco Mundial basados en fuentes y métodos que aparecen en la publicación del Banco Mundial ""The Changing Wealth of Nations: Measuring Sustainable Development in the New Millennium"" (La riqueza variable de las naciones: Medición del desarrollo sostenible en el nuevo milenio) (2011)."
42,NY.ADJ.DKAP.GN.ZS,Ahorro ajustado: consumo de capital fijo (% del INB),El consumo de capital fijo representa el valor de reposición del capital utilizado en su totalidad durante el proceso de producción.,"Estimaciones del personal del Banco Mundial, de acuerdo con datos extraídos de estadísticas sobre cuentas nacionales de la División de Estadística de las Naciones Unidas."
43,NY.ADJ.DKAP.CD,Ahorro ajustado: consumo de capital fijo (US$ actuales),El consumo de capital fijo representa el valor de reposición del capital utilizado en su totalidad durante el proceso de producción.,"Estimaciones del personal del Banco Mundial, de acuerdo con datos extraídos de estadísticas sobre cuentas nacionales de la División de Estadística de las Naciones Unidas."
44,NY.ADJ.DFOR.GN.ZS,Ahorro ajustado: agotamiento neto de recursos forestales (% del INB),El agotamiento neto de recursos forestales se calcula como el producto de la renta unitaria de los recursos y el excedente de la cosecha de rollizos sobre el crecimiento natural.,"Cálculos del personal del Banco Mundial basados en fuentes y métodos que aparecen en la publicación del Banco Mundial ""The Changing Wealth of Nations: Measuring Sustainable Development in the New Millennium"" (La riqueza variable de las naciones: Medición del desarrollo sostenible en el nuevo milenio) (2011)."
45,NY.ADJ.DFOR.CD,Ahorro ajustado: agotamiento neto de recursos forestales (US$ a precios actuales),El agotamiento neto de recursos forestales se calcula como el producto de la renta unitaria de los recursos y el excedente de la cosecha de rollizos sobre el crecimiento natural.,"Cálculos del personal del Banco Mundial basados en fuentes y métodos que aparecen en la publicación del Banco Mundial ""The Changing Wealth of Nations: Measuring Sustainable Development in the New Millennium"" (La riqueza variable de las naciones: Medición del desarrollo sostenible en el nuevo milenio) (2011)."
46,NY.ADJ.DCO2.GN.ZS,Ahorro ajustado: daño por emisión de dióxido de carbono (% del INB),El daño por emisión de dióxido de carbono se estima en US$20 por tonelada de carbono (daño unitario en dólares de los Estados Unidos de 1995) multiplicado por la cantidad de toneladas de carbono emitidas.,"Estimaciones del personal del Banco Mundial, sobre la base de “Valuing Climate Change: The Economics of the Greenhouse” (1995), de Samuel Fankhauser."
47,NY.ADJ.DCO2.CD,Ahorro ajustado: daño por emisión de dióxido de carbono (US$ actuales),El daño por emisión de dióxido de carbono se estima en US$20 por tonelada de carbono (daño unitario en dólares de los Estados Unidos de 1995) multiplicado por la cantidad de toneladas de carbono emitidas.,"Estimaciones del personal del Banco Mundial, sobre la base de “Valuing Climate Change: The Economics of the Greenhouse” (1995), de Samuel Fankhauser."
48,NY.ADJ.AEDU.GN.ZS,Ahorro ajustado: gasto en educación (% del INB),"El término gastos en educación se refiere a los gastos operativos corrientes en educación, que incluye sueldos y salarios, y excluyen inversiones de capital en edificios y equipos.","Estimaciones del personal del Banco Mundial, de acuerdo con datos extraídos del Statistical Yearbook (anuario estadístico) de la División de Estadística de las Naciones Unidas y de la base de datos en línea del Instituto de Estadística de la Organización de las Naciones Unidas para la Educación, la Ciencia y la Cultura (UNESCO)."
49,NY.ADJ.AEDU.CD,Ahorro ajustado: gasto en educación (US$ actuales),"El término gastos en educación se refiere a los gastos operativos corrientes en educación, que incluye sueldos y salarios, y excluyen inversiones de capital en edificios y equipos.","Estimaciones del personal del Banco Mundial, de acuerdo con datos extraídos del Statistical Yearbook (anuario estadístico) de la División de Estadística de las Naciones Unidas y de la base de datos en línea del Instituto de Estadística de la Organización de las Naciones Unidas para la Educación, la Ciencia y la Cultura (UNESCO)."
50,ER.PTD.TOTL.ZS,Áreas protegidas terrestres y marinas (% del total de la superficie territorial),"Las áreas protegidas terrestres son zonas total o parcialmente protegidas de por lo menos 1.000 hectáreas designadas por autoridades nacionales como reservas científicas con acceso público limitado, parques nacionales, monumentos nacionales, reservas naturales o santuarios de la naturaleza, paisajes protegidos y zonas manejadas principalmente para uso sostenible. Las áreas marinas protegidas son zonas de terreno intermareal o submareal, junto con sus aguas suprayacentes y su flora, fauna y características históricas y culturales conexas, que han sido reservadas por ley o por cualquier otro medio eficaz para proteger parte del entorno que encierra o su totalidad. No se incluyen las zonas protegidas conforme a leyes locales o provinciales.","Programa de las Naciones Unidas para el Medio Ambiente y Centro de Seguimiento de la Conservación Mundial, según la recopilación del Instituto de Recursos Mundiales sobre la base de datos de autoridades nacionales, legislación nacional y acuerdos internacionales."
51,ER.MRN.PTMR.ZS,Áreas marinas protegidas (% de las aguas territoriales),"Las áreas marinas protegidas son zonas de terreno intermareal o submareal, junto con sus aguas suprayacentes y su flora, fauna y características históricas y culturales conexas, que han sido reservadas por ley o por cualquier otro medio eficaz para proteger parte del entorno que encierra o su totalidad.","Programa de las Naciones Unidas para el Medio Ambiente y Centro de Seguimiento de la Conservación Mundial, según la recopilación del Instituto de Recursos Mundiales sobre la base de datos de autoridades nacionales, legislación nacional y acuerdos internacionales."
52,ER.LND.PTLD.ZS,Áreas terrestres protegidas (% del área total de la tierra),"Las áreas protegidas terrestres son zonas total o parcialmente protegidas de por lo menos 1.000 hectáreas designadas por autoridades nacionales como reservas científicas con acceso público limitado, parques nacionales, monumentos nacionales, reservas naturales o santuarios de la naturaleza, paisajes protegidos y zonas manejadas principalmente para uso sostenible. Las áreas marinas protegidas son zonas de terreno intermareal o submareal, junto con sus aguas suprayacentes y su flora, fauna y características históricas y  culturales conexas, que han sido reservadas por ley o por cualquier otro medio eficaz para proteger parte del entorno que encierra o su totalidad. No se incluyen las zonas protegidas conforme a leyes locales o provinciales.","Programa de las Naciones Unidas para el Medio Ambiente y Centro de Seguimiento de la Conservación Mundial, según la recopilación del Instituto de Recursos Mundiales sobre la base de datos de autoridades nacionales, legislación nacional y acuerdos internacionales."
53,ER.H2O.INTR.PC,Recursos de agua dulce  internos renovables per cápita (metros cúbicos),Los flujos de recursos de agua dulce internos renovables se refieren a los recursos renovables internos del país (caudales de ríos internos y agua freática originada por lluvias). Los recursos de agua dulce internos renovables per cápita se calculan a partir de las estimaciones de población del Banco Mundial.,"Organización de las Naciones Unidas para la Agricultura y la Alimentación, datos de AQUASTAT."
54,ER.H2O.INTR.K3,"Recursos de agua dulce  internos renovables, total (billones de metros cúbicos)",Los flujos de recursos de agua dulce internos renovables se refieren a los recursos renovables internos del país (caudales de ríos internos y agua freática originada por lluvias).,"Organización de las Naciones Unidas para la Agricultura y la Alimentación, datos de AQUASTAT."
55,ER.H2O.FWTL.ZS,"Extracción anual de agua dulce, total (% de recursos internos)","La extracción anual de agua dulce se refiere al total de extracción de agua, sin contar las pérdidas por evaporación de las cuencas de almacenamiento. La extracción incluye además el agua de las plantas de desalinización en países donde estas son una fuente importante. La extracción puede exceder el 100% del total de recursos renovables en aquellos casos de gran volumen de extracción a partir de acuíferos no renovables o de plantas de desalinización o en que existe una importante reutilización del agua. La extracción para la agricultura y la industria es el total de extracción con fines de riego y la producción animal y para uso industrial directo (incluida la destinada a refrigerar plantas termoeléctricas). La extracción para consumo doméstico incluye agua potable, uso o suministro municipal y uso para servicios públicos, establecimientos comerciales y hogares. Los datos corresponden al año más reciente disponible en el período 1987-2002.","Organización de las Naciones Unidas para la Agricultura y la Alimentación, datos de AQUASTAT."
56,ER.H2O.FWTL.K3,"Extracción anual de agua dulce, total (en billones de metros cúbicos)","La extracción anual de agua dulce se refiere al total de extracción de agua, sin contar las pérdidas por evaporación de las cuencas de almacenamiento. La extracción incluye además el agua de las plantas de desalinización en países donde estas son una fuente importante. La extracción puede exceder el 100% del total de recursos renovables en aquellos casos de gran volumen de extracción a partir de acuíferos no renovables o de plantas de desalinización o en que existe una importante reutilización del agua. La extracción para la agricultura y la industria es el total de extracción con fines de riego y la producción animal y para uso industrial directo (incluida la destinada a refrigerar plantas termoeléctricas). La extracción para consumo doméstico incluye agua potable, uso o suministro municipal y uso para servicios públicos, establecimientos comerciales y hogares. Los datos corresponden al año más reciente disponible en el período 1987-2002.","Organización de las Naciones Unidas para la Agricultura y la Alimentación, datos de AQUASTAT."
57,ER.H2O.FWIN.ZS,Extracción anual de agua dulce para uso industrial (% del total de extracción de agua dulce),"La extracción anual de agua dulce se refiere al total de extracción de agua, sin contar las pérdidas por evaporación de las cuencas de almacenamiento. La extracción incluye además el agua de las plantas de desalinización en países donde estas son una fuente importante. La extracción puede exceder el 100% del total de recursos renovables en aquellos casos de gran volumen de extracción a partir de acuíferos no renovables o de plantas de desalinización o en que existe una importante reutilización del agua. La extracción para la industria es el total de extracción para uso industrial directo (incluida la destinada a refrigerar plantas termoeléctricas). Los datos corresponden al año más reciente disponible en el período 1987-2002.","Organización de las Naciones Unidas para la Agricultura y la Alimentación, datos de AQUASTAT."
58,ER.H2O.FWDM.ZS,Extracción anual de agua dulce para uso doméstico (% del total de extracción de agua dulce),"La extracción anual de agua dulce se refiere al total de extracción de agua, sin contar las pérdidas por evaporación de las cuencas de almacenamiento. La extracción incluye además el agua de las plantas de desalinización en países donde estas son una fuente importante. La extracción puede exceder el 100% del total de recursos renovables en aquellos casos de gran volumen de extracción a partir de acuíferos no renovables o de plantas de desalinización o en que existe una importante reutilización del agua. La extracción para consumo doméstico incluye agua potable, uso o suministro municipal y uso para servicios públicos, establecimientos comerciales y hogares. Los datos corresponden al año más reciente disponible en el período 1987-2002.","Organización de las Naciones Unidas para la Agricultura y la Alimentación, datos de AQUASTAT."
