,INDICATOR_CODE,INDICATOR_NAME,SOURCE_NOTE,SOURCE_ORGANIZATION
94,EN.ATM.METH.AG.ZS,Emisiones de metano procedentes de la actividad agrícola (% del total),"Emisiones de metano procedentes de la actividad agrícola son emisiones originadas por animales, desechos animales, producción de arroz, quema de residuos agrícolas (no energéticos, in situ) y quema de sabanas.","Estimaciones del personal del Banco Mundial a partir de la fuente original: Comisión Europea, Centro Común de Investigación (JRC)/Agencia de Evaluación Ambiental de los Países Bajos (PBL). Base de Datos de Emisiones para la Investigación Atmosférica Global (EDGAR): http://edgar.jrc.ec.europa.eu/."
95,EN.ATM.METH.AG.KT.CE,Emisiones agrícolas de gas metano (miles de toneladas métricas de equivalente de CO2),"Emisiones de metano procedentes de la actividad agrícola son emisiones originadas por animales, desechos animales, producción de arroz, quema de residuos agrícolas (no energéticos, in situ) y quema de sabanas.","Comisión Europea, Centro Común de Investigación (JRC)/Agencia de Evaluación Ambiental de los Países Bajos (PBL). Base de Datos de Emisiones para la Investigación Atmosférica Global (EDGAR): http://edgar.jrc.ec.europa.eu/."
96,EN.ATM.HFCG.KT.CE,Emisiones de gas HFC (miles de toneladas métricas de equivalente de CO2),"Los hidrofluorocarbonos, usados para reemplazar los clorofluorocarbonos, se utilizan principalmente en refrigeración y en fabricación de semiconductores.","Comisión Europea, Centro Común de Investigación (JRC)/Agencia de Evaluación Ambiental de los Países Bajos (PBL). Base de Datos de Emisiones para la Investigación Atmosférica Global (EDGAR): http://edgar.jrc.ec.europa.eu/."
97,EN.ATM.GHGT.ZG,Emisiones de gases de efecto invernadero totales (% de cambio desde 1990),"Total greenhouse gas emissions are composed of CO2 totals excluding short-cycle biomass burning (such as agricultural waste burning and Savannah burning) but including other biomass burning (such as forest fires, post-burn decay, peat fires and decay of drained peatlands), all anthropogenic CH4 sources, N2O sources and F-gases (HFCs, PFCs and SF6). Each year of data shows the percentage change to that year from 1990.","Estimaciones del personal del Banco Mundial a partir de la fuente original: Comisión Europea, Centro Común de Investigación (JRC)/Agencia de Evaluación Ambiental de los Países Bajos (PBL). Base de Datos de Emisiones para la Investigación Atmosférica Global (EDGAR): http://edgar.jrc.ec.europa.eu/."
98,EN.ATM.GHGT.KT.CE,Emisiones de gases de efecto invernadero totales (kt de equivalente de CO2),"Total greenhouse gas emissions in kt of CO2 equivalent are composed of CO2 totals excluding short-cycle biomass burning (such as agricultural waste burning and Savannah burning) but including other biomass burning (such as forest fires, post-burn decay, peat fires and decay of drained peatlands), all anthropogenic CH4 sources, N2O sources and F-gases (HFCs, PFCs and SF6).","Comisión Europea, Centro Común de Investigación (JRC)/Agencia de Evaluación Ambiental de los Países Bajos (PBL). Base de Datos de Emisiones para la Investigación Atmosférica Global (EDGAR), EDGARv4.2 FT2012: http://edgar.jrc.ec.europa.eu/."
99,EN.ATM.GHGO.ZG,Otras emisiones de gases de efecto invernadero (% de cambio desde 1990),"Other greenhouse gas emissions are by-product emissions of hydrofluorocarbons, perfluorocarbons, and sulfur hexafluoride. Each year of data shows the percentage change to that year from 1990.","World Bank staff estimates from original source: European Commission, Joint Research Centre (JRC)/Netherlands Environmental Assessment Agency (PBL). Emission Database for Global Atmospheric Research (EDGAR): http://edgar.jrc.ec.europa.eu/."
100,EN.ATM.GHGO.KT.CE,"Otras emisiones de gases de efecto invernadero, hidrofluorocarbonos (HFC),  perfluorocarbonos (PFC) y hexafluoruro de azufre (SF6) (miles de toneladas métricas de equivalente de CO2)","Otras emisiones de gases de efecto invernadero son emisiones derivadas de hidrofluorocarburos, perfluorocarburos y hexafluoruro de azufre.","Estimaciones del personal del Banco Mundial a partir de la fuente original: Comisión Europea, Centro Común de Investigación (JRC)/Agencia de Evaluación Ambiental de los Países Bajos (PBL). Base de Datos de Emisiones para la Investigación Atmosférica Global (EDGAR): http://edgar.jrc.ec.europa.eu/."
101,EN.ATM.CO2E.SF.ZS,Emisiones de CO2 procedentes del consumo de combustibles sólidos (% del total),Las emisiones de dióxido de carbono a partir del consumo de combustibles sólidos se refieren a las emisiones generadas por el uso del carbón como fuente de energía.,"Centro de Análisis de Información sobre Dióxido de Carbono, División de Ciencias Ambientales del Laboratorio Nacional de Oak Ridge (Tennessee, Estados Unidos)."
102,EN.ATM.CO2E.SF.KT,Emisiones de CO2 del consumo de combustibles sólidos (kilotoneladas)  ,Las emisiones de dióxido de carbono a partir del consumo de combustibles sólidos se refieren a las emisiones generadas por el uso del carbón como fuente de energía.,"Centro de Análisis de Información sobre Dióxido de Carbono, División de Ciencias Ambientales del Laboratorio Nacional de Oak Ridge (Tennessee, Estados Unidos)."
103,EN.ATM.CO2E.PP.GD.KD,Emisiones de CO2 (kg por PPA: paridad del poder adquisitivo del PIB de 2011),"Las emisiones de dióxido de carbono son las que provienen de la quema de combustibles fósiles y de la fabricación del cemento. Incluyen el dióxido de carbono producido durante el consumo de combustibles sólidos, líquidos, gaseosos y de la quema de gas.","Centro de Análisis de Información sobre Dióxido de Carbono, División de Ciencias Ambientales del Laboratorio Nacional de Oak Ridge (Tennessee, Estados Unidos)."
104,EN.ATM.CO2E.PP.GD,Emisiones de CO2 (kg por PPA del PIB),"Las emisiones de dióxido de carbono son las que provienen de la quema de combustibles fósiles y de la fabricación del cemento. Incluyen el dióxido de carbono producido durante el consumo de combustibles sólidos, líquidos, gaseosos y de la quema de gas.","Centro de Análisis de Información sobre Dióxido de Carbono, División de Ciencias Ambientales del Laboratorio Nacional de Oak Ridge (Tennessee, Estados Unidos)."
105,EN.ATM.CO2E.PC,Emisiones de CO2 (toneladas métricas per cápita),"Las emisiones de dióxido de carbono son las que provienen de la quema de combustibles fósiles y de la fabricación del cemento. Incluyen el dióxido de carbono producido durante el consumo de combustibles sólidos, líquidos, gaseosos y de la quema de gas.","Centro de Análisis de Información sobre Dióxido de Carbono, División de Ciencias Ambientales del Laboratorio Nacional de Oak Ridge (Tennessee, Estados Unidos)."
106,EN.ATM.CO2E.LF.ZS,Las emisiones de CO2 derivadas del consumo de combustible líquido ( % del total),Las emisiones de dióxido de carbono del consumo de combustibles líquidos se refieren principalmente a las emisiones del uso de combustibles derivados del petróleo como fuente de energía.,"Centro de Análisis de Información sobre Dióxido de Carbono, División de Ciencias Ambientales del Laboratorio Nacional de Oak Ridge (Tennessee, Estados Unidos)."
107,EN.ATM.CO2E.LF.KT,Emisiones de CO2 del consumo de combustible líquido (% del total)  ,Las emisiones de dióxido de carbono del consumo de combustibles líquidos se refieren principalmente a las emisiones del uso de combustibles derivados del petróleo como fuente de energía.,"Centro de Análisis de Información sobre Dióxido de Carbono, División de Ciencias Ambientales del Laboratorio Nacional de Oak Ridge (Tennessee, Estados Unidos)."
108,EN.ATM.CO2E.KT,Emisiones de CO2 (kt),"Las emisiones de dióxido de carbono son las que provienen de la quema de combustibles fósiles y de la fabricación del cemento. Incluyen el dióxido de carbono producido durante el consumo de combustibles sólidos, líquidos, gaseosos y de la quema de gas.","Centro de Análisis de Información sobre Dióxido de Carbono, División de Ciencias Ambientales del Laboratorio Nacional de Oak Ridge (Tennessee, Estados Unidos)."
109,EN.ATM.CO2E.KD.GD,Emisiones de CO2 (kg por US$ del PIB de 2010),"Las emisiones de dióxido de carbono son las que provienen de la quema de combustibles fósiles y de la fabricación del cemento. Incluyen el dióxido de carbono producido durante el consumo de combustibles sólidos, líquidos, gaseosos y de la quema de gas.","Centro de Análisis de Información sobre Dióxido de Carbono, División de Ciencias Ambientales del Laboratorio Nacional de Oak Ridge (Tennessee, Estados Unidos)."
110,EN.ATM.CO2E.GF.ZS,Emisiones de CO2 del consumo de combustible gaseoso (% del total)  ,Las emisiones de dióxido de carbono del consumo de combustibles líquidos se refieren principalmente a las emisiones del uso de gas natural como fuente de energía.,"Centro de Análisis de Información sobre Dióxido de Carbono, División de Ciencias Ambientales del Laboratorio Nacional de Oak Ridge (Tennessee, Estados Unidos)."
111,EN.ATM.CO2E.GF.KT,Emisiones de CO2 del consumo de combustible gaseoso (kilotoneladas)  ,Las emisiones de dióxido de carbono del consumo de combustibles líquidos se refieren principalmente a las emisiones del uso de gas natural como fuente de energía.,"Centro de Análisis de Información sobre Dióxido de Carbono, División de Ciencias Ambientales del Laboratorio Nacional de Oak Ridge (Tennessee, Estados Unidos)."
112,EN.ATM.CO2E.EG.ZS,Intensidad de CO2 (kg de uso de energía por kg de equivalente de petróleo),Las emisiones de dióxido de carbono a partir del consumo de combustibles sólidos se refieren a las emisiones generadas por el uso del carbón como fuente de energía.,"Centro de Análisis de Información sobre Dióxido de Carbono, División de Ciencias Ambientales del Laboratorio Nacional de Oak Ridge (Tennessee, Estados Unidos)."
113,EG.FEC.RNEW.ZS,Consumo de energía renovable (% del consumo total de energía final),Renewable energy consumption is the share of renewables energy in total final energy consumption.,"Banco Mundial, base de datos de Energía Sostenible para Todos (SE4ALL) del Marco de Seguimiento Mundial de SE4ALL liderado de forma conjunta por el Banco Mundial, la Agencia Internacional de la Energía y el Programa de Asistencia para la Gestión del Sector de Energía."
114,EG.ELC.RNWX.ZS,"Producción de electricidad a partir de fuentes renovables, excluida la hidroeléctrica (% del total)","Electricity production from renewable sources, excluding hydroelectric, includes geothermal, solar, tides, wind, biomass, and biofuels.","Estadísticas de la Agencia Internacional de la Energía (AIE) © OECD/AIE 2014 (http://www.iea.org/stats/index.asp), sujeto a https://www.iea.org/t&c/termsandconditions/"
115,EG.ELC.RNWX.KH,"Producción de electricidad a partir de fuentes renovables, excluida la hidroeléctrica (kilovatio-hora)","Electricity production from renewable sources, excluding hydroelectric, includes geothermal, solar, tides, wind, biomass, and biofuels.","Estadísticas de la Agencia Internacional de la Energía (AIE) © OECD/AIE 2014 (http://www.iea.org/stats/index.asp), sujeto a https://www.iea.org/t&c/termsandconditions/"
116,EG.ELC.RNEW.ZS,Producción de energía eléctrica renovable (% de la producción total de electricidad),Renewable electricity is the share of electrity generated by renewable power plants in total electricity generated by all types of plants.,"Banco Mundial, base de datos de Energía Sostenible para Todos (SE4ALL) del Marco de Seguimiento Mundial de SE4ALL liderado de forma conjunta por el Banco Mundial, la Agencia Internacional de la Energía y el Programa de Asistencia para la Gestión del Sector de Energía."
117,EG.ELC.FOSL.ZS,"Producción de electricidad a partir de fuentes de petróleo, gas y carbón (% del total)","Se denominan fuentes de electricidad a los insumos que se utilizan para generar electricidad. El petróleo se refiere al crudo y a los derivados del petróleo. El gas se refiere al gas natural pero excluye los líquidos de gas natural. El carbón se refiere a todos los tipos de carbón y el carbón pardo, tanto primarios (como el carbón de antracita y el carbón pardo-lignito) como combustibles derivados (incluidos el aglomerado de hulla, el coque de horno de coque, el coque de gas, el gas de horno de coque y el gas de altos hornos). La turba también se incluye en esta categoría.","Agencia Internacional de la Energía (AIE) (Estadísticas de la AIE © OCDE/AIE, http://www.iea.org/stats/index.asp); Estadísticas de energía y balances de países no pertenecientes a la OCDE; Estadísticas de energía de países de la OCDE, y balances de energía de países de la OCDE."
118,EG.ELC.ACCS.ZS,Acceso a la electricidad (% de población),"Acceso a la electricidad es el porcentaje de población con acceso a la electricidad. Los datos de electrificación se recopilan de la industria, las encuestas","Banco Mundial, base de datos de Energía Sostenible para Todos (SE4ALL) del Marco de Seguimiento Mundial de SE4ALL liderado de forma conjunta por el Banco Mundial, la Agencia Internacional de la Energía y el Programa de Asistencia para la Gestión del Sector de Energía."
119,EG.EGY.PRIM.PP.KD,Nivel de intensidad energética de la energía primaria (megajulios/PIB en USD según la PPA de 2011),"Access to electricity, rural is the percentage of rural population with access to electricity.","Banco Mundial, base de datos de Energía Sostenible para Todos (SE4ALL) del Marco de Seguimiento Mundial de SE4ALL liderado de forma conjunta por el Banco Mundial, la Agencia Internacional de la Energía y el Programa de Asistencia para la Gestión del Sector de Energía."
120,EG.CFT.ACCS.ZS,Acceso a tecnologías y combustibles limpios para cocinar (% de la población),"Access to clean fuels and technologies for cooking is the proportion of total population primarily using clean cooking fuels and technologies for cooking. Under WHO guidelines, kerosene is excluded from clean cooking fuels.","Banco Mundial, base de datos de Energía Sostenible para Todos (SE4ALL) a partir de la base de datos mundial de la OMS sobre el uso energético en los hogares."
121,AG.SRF.TOTL.K2,Superficie (kilómetros cuadrados),"Por superficie se entiende la superficie total de un país, incluidas las zonas cubiertas por masas de agua interiores y algunas vías navegables costeras.","Organización de las Naciones Unidas para la Agricultura y la Alimentación, archivos electrónicos y sitio web."
122,AG.LND.TOTL.UR.K2,Área de tierra urbana (kilómetros cuadrados),"Urban land area in square kilometers, based on a combination of population counts (persons), settlement points, and the presence of Nighttime Lights. Areas are defined as urban where contiguous lighted cells from the Nighttime Lights or approximated urban extents based on buffered settlement points for which the total population is greater than 5,000 persons.","Centro para la Red Internacional de Información sobre Ciencias de la Tierra (CIESIN)/Universidad de Columbia. 2013. Urban-Rural Population and Land Area Estimates Version 2. Palisades, Nueva York: Centro de Datos y Aplicaciones Socioeconómicas (SEDAC) de la NASA. http://sedac.ciesin.columbia.edu/data/set/lecz-urban-rural-population-land-area-estimates-v2."
123,AG.LND.TOTL.RU.K2,Área de tierra rural (kilómetros cuadrados),"Rural land area in square kilometers, derived from urban extent grids which distinguish urban and rural areas based on a combination of population counts (persons), settlement points, and the presence of Nighttime Lights. Areas are defined as urban where contiguous lighted cells from the Nighttime Lights or approximated urban extents based on buffered settlement points for which the total population is greater than 5,000 persons.","Centro para la Red Internacional de Información sobre Ciencias de la Tierra (CIESIN)/Universidad de Columbia. 2013. Urban-Rural Population and Land Area Estimates Version 2. Palisades, Nueva York: Centro de Datos y Aplicaciones Socioeconómicas (SEDAC) de la NASA. http://sedac.ciesin.columbia.edu/data/set/lecz-urban-rural-population-land-area-estimates-v2."
124,AG.LND.TOTL.K2,Área de tierra (kilómetros cuadrados),"El área de tierra es la superficie total de un país, sin incluir la superficie cubierta por masas de agua interiores, los derechos del país sobre la plataforma continental ni las zonas económicas exclusivas. En la mayoría de los casos, la definición de masas de agua interiores incluye los principales ríos y lagos.","Organización de las Naciones Unidas para la Agricultura y la Alimentación, archivos electrónicos y sitio web."
125,AG.LND.PRCP.MM,Promedio detallado de precipitaciones (mm anuales)  ,Precipitación media es el promedio a largo plazo en profundidad (sobre espacio y tiempo) de precipitación anual en el país. La precipitación se define como cualquier tipo de agua que cae de las nubes en forma líquida o sólida.,"Organización de las Naciones Unidas para la Agricultura y la Alimentación, archivos electrónicos y sitio web."
126,AG.LND.FRST.ZS,Área selvática (% del área de tierra),"La superficie forestal se refiere a las tierras con agrupaciones de árboles naturales o plantados de por lo menos 5 metros in situ, sean estas para usos productivos o no, y excluye las poblaciones en los sistemas de producción agrícola (por ejemplo, en plantaciones frutales y sistemas agroforestales) y los árboles en los parques y jardines urbanos.","Organización de las Naciones Unidas para la Agricultura y la Alimentación, archivos electrónicos y sitio web."
127,AG.LND.FRST.K2,Área selvática  (kilómetros cuadrados),"La superficie forestal se refiere a las tierras con agrupaciones de árboles naturales o plantados de por lo menos 5 metros in situ, sean estas para usos productivos o no, y excluye las poblaciones en los sistemas de producción agrícola (por ejemplo, en plantaciones frutales y sistemas agroforestales) y los árboles en los parques y jardines urbanos.","Organización de las Naciones Unidas para la Agricultura y la Alimentación, archivos electrónicos y sitio web."
128,AG.LND.EL5M.ZS,Superficie del terreno donde la elevación es inferior a 5 metros (% de la superficie total),Superficie del terreno por debajo de 5 metros es el porcentaje de la superficie total donde la elevación es de 5 metros o menos.,"Centro para la Red Internacional de Información sobre las Ciencias de la Tierra (CIESIN, por sus siglas en inglés), Conjunto de datos Place II."
129,AG.LND.EL5M.UR.ZS,Área de tierra urbana donde la elevación es inferior a 5 metros (% de la superficie total),Urban land area below 5m is the percentage of total land where the urban land elevation is 5 meters or less.,"Centro para la Red Internacional de Información sobre Ciencias de la Tierra (CIESIN)/Universidad de Columbia. 2013. Urban-Rural Population and Land Area Estimates Version 2. Palisades, Nueva York: Centro de Datos y Aplicaciones Socioeconómicas (SEDAC) de la NASA. http://sedac.ciesin.columbia.edu/data/set/lecz-urban-rural-population-land-area-estimates-v2."
130,AG.LND.EL5M.UR.K2,Área de tierra urbana donde la elevación es inferior a 5 metros (kilómetros cuadrados),Urban land area below 5m is the total urban land area in square kilometers where the elevation is 5 meters or less.,"Centro para la Red Internacional de Información sobre Ciencias de la Tierra (CIESIN)/Universidad de Columbia. 2013. Urban-Rural Population and Land Area Estimates Version 2. Palisades, Nueva York: Centro de Datos y Aplicaciones Socioeconómicas (SEDAC) de la NASA. http://sedac.ciesin.columbia.edu/data/set/lecz-urban-rural-population-land-area-estimates-v2."
131,AG.LND.EL5M.RU.ZS,Área de tierra rural donde la elevación es inferior a 5 metros (% de la superficie total),Rural land area below 5m is the percentage of total land where the rural land elevation is 5 meters or less.,"Centro para la Red Internacional de Información sobre Ciencias de la Tierra (CIESIN)/Universidad de Columbia. 2013. Urban-Rural Population and Land Area Estimates Version 2. Palisades, Nueva York: Centro de Datos y Aplicaciones Socioeconómicas (SEDAC) de la NASA. http://sedac.ciesin.columbia.edu/data/set/lecz-urban-rural-population-land-area-estimates-v2."
132,AG.LND.EL5M.RU.K2,Área de tierra rural donde la elevación es inferior a 5 metros (kilómetros cuadrados),Rural land area below 5m is the total rural land area in square kilometers where the elevation is 5 meters or less.,"Centro para la Red Internacional de Información sobre Ciencias de la Tierra (CIESIN)/Universidad de Columbia. 2013. Urban-Rural Population and Land Area Estimates Version 2. Palisades, Nueva York: Centro de Datos y Aplicaciones Socioeconómicas (SEDAC) de la NASA. http://sedac.ciesin.columbia.edu/data/set/lecz-urban-rural-population-land-area-estimates-v2."
133,AG.LND.ARBL.ZS,Tierras cultivables (% del área de tierra),"La tierra cultivable incluye aquellos terrenos definidos por la FAO como afectados a cultivos temporales (las zonas de doble cosecha se cuentan una sola vez), los prados temporales para segar o para pasto, las tierras cultivadas como huertos comerciales o domésticos, y las tierras temporalmente en barbecho. Se excluyen las tierras abandonadas a causa del cultivo migratorio.","Organización de las Naciones Unidas para la Agricultura y la Alimentación, archivos electrónicos y sitio web."
134,AG.LND.AGRI.ZS,Tierras agrícolas (% del área de tierra),"Se denomina tierra agrícola a la porción del área de tierra cultivable, afectada a  cultivo permanente y a pradera permanente. La tierra cultivable incluye aquellos terrenos definidos por la FAO como afectados a cultivos temporales (las zonas de doble cosecha se cuentan una sola vez), los prados temporales para segar o para pasto, las tierras cultivadas como huertos comerciales o domésticos, y las tierras temporalmente en barbecho. Se excluyen las tierras abandonadas a causa del cultivo migratorio. La tierra destinada a cultivos permanentes es aquella en que se siembran cultivos que ocupan la tierra durante períodos prolongados y que no necesitan replantarse tras cada cosecha, como el cacao, el café y el caucho. En esta categoría se incluyen los terrenos con arbustos de flores, árboles frutales, árboles de frutos secos y vides, pero se excluyen aquellos donde se siembran árboles para obtener madera o madera de construcción. Las praderas permanentes son los terrenos que se explotan durante cinco o más años para forraje, ya se trate de especies naturales o cultivadas.","Organización de las Naciones Unidas para la Agricultura y la Alimentación, archivos electrónicos y sitio web."
