,INDICATOR_CODE,INDICATOR_NAME,SOURCE_NOTE,SOURCE_ORGANIZATION
59,ER.H2O.FWAG.ZS,Extracción anual de agua dulce para uso agrícola (% del total de extracción de agua dulce),"La extracción anual de agua dulce se refiere al total de extracción de agua, sin contar las pérdidas por evaporación de las cuencas de almacenamiento. La extracción incluye además el agua de las plantas de desalinización en países donde estas son una fuente importante. La extracción puede exceder el 100% del total de recursos renovables en aquellos casos de gran volumen de extracción a partir de acuíferos no renovables o de plantas de desalinización o en que existe una importante reutilización del agua. La extracción para la agricultura es el total de extracción para riego y para la producción animal. Los datos corresponden al año más reciente disponible en el período 1987-2002.","Organización de las Naciones Unidas para la Agricultura y la Alimentación, datos de AQUASTAT."
60,ER.GDP.FWTL.M3.KD,"Productividad del agua, total (PIB en US$ constantes del año 2010 por metro cúbico de extracción total de agua dulce)",La productividad del agua se calcula como el PIB a precios constantes dividido por la extracción total de agua dulce anual.,"Organización de las Naciones Unidas para la Agricultura y la Alimentación, datos de AQUASTAT y cálculos del PIB del Banco Mundial y de la OCDE."
61,ER.FSH.PROD.MT,Producción pesquera total (toneladas métricas),"Total fisheries production measures the volume of aquatic species caught by a country for all commercial, industrial, recreational and subsistence purposes. The harvest from mariculture, aquaculture and other kinds of fish farming is also included.",Organización para la Alimentación y la Agricultura.
62,ER.FSH.CAPT.MT,Producción de la pesca de captura (toneladas métricas),"Capture fisheries production measures the volume of fish catches landed by a country for all commercial, industrial, recreational and subsistence purposes.",Organización para la Alimentación y la Agricultura.
63,ER.FSH.AQUA.MT,Producción acuícola (toneladas métricas),"Aquaculture is understood to mean the farming of aquatic organisms including fish, molluscs, crustaceans and aquatic plants. Aquaculture production specifically refers to output from aquaculture activities, which are designated for final harvest for consumption.",Food and Agriculture Organization.
64,EN.POP.SLUM.UR.ZS,Población que vive en barrios de tugurios (% de la población urbana),"Population living in slums is the proportion of the urban population living in slum households. A slum household is defined as a group of individuals living under the same roof lacking one or more of the following conditions: access to improved water, access to improved sanitation, sufficient living area, and durability of housing.","ONU HÁBITAT, consultado en la base de datos de los objetivos de desarrollo del milenio de las Naciones Unidas. Los datos están disponibles en el sitio web http://mdgs.un.org/."
65,EN.POP.EL5M.ZS,Población que vive en zonas donde la elevación es inferior a 5 metros (% de la población total),Población por debajo de 5 metros es el porcentaje de la población total que vive en zonas donde la elevación es de 5 metros o menos.,"Centro para la Red Internacional de Información sobre las Ciencias de la Tierra (CIESIN, por sus siglas en inglés), Conjunto de datos Place II."
66,EN.POP.EL5M.UR.ZS,Población urbana que vive en áreas donde la elevación es inferior a 5 metros (% de la población total),"Urban population below 5m is the percentage of the total population, living in areas where the elevation is 5 meters or less.","Centro para la Red Internacional de Información sobre Ciencias de la Tierra (CIESIN)/Universidad de Columbia. 2013. Urban-Rural Population and Land Area Estimates Version 2. Palisades, Nueva York: Centro de Datos y Aplicaciones Socioeconómicas (SEDAC) de la NASA. http://sedac.ciesin.columbia.edu/data/set/lecz-urban-rural-population-land-area-estimates-v2."
67,EN.POP.EL5M.RU.ZS,Población rural que vive en áreas donde la elevación es inferior a 5 metros (% de la población total),"Rural population below 5m is the percentage of the total population, living in areas where the elevation is 5 meters or less.","Center for International Earth Science Information Network (CIESIN)/Columbia University. 2013. Urban-Rural Population and Land Area Estimates Version 2. Palisades, NY: NASA Socioeconomic Data and Applications Center (SEDAC). http://sedac.ciesin.columbia.edu/data/set/lecz-urban-rural-population-land-area-estimates-v2."
68,EN.MAM.THRD.NO,"Especies de mamíferos, en peligro","En las especies de mamíferos se excluye a las ballenas y marsopas. Las especies en peligro de extinción son las que la UICN clasifica como amenazadas, vulnerables, exóticas, indeterminadas, fuera de peligro o no suficientemente conocidas.","Programa de las Naciones Unidas para el Medio Ambiente y Centro Mundial de Vigilancia de la Conservación, y Unión Internacional para la Conservación de la Naturaleza, Lista Roja de especies amenazadas."
69,EN.HPT.THRD.NO,"Especies de plantas (superiores), en peligro","Las plantas superiores son especies nativas de plantas vasculares. Las especies en peligro de extinción son las que la UICN clasifica como amenazadas, vulnerables, exóticas, indeterminadas, fuera de peligro o no suficientemente conocidas.","Programa de las Naciones Unidas para el Medio Ambiente y Centro Mundial de Vigilancia de la Conservación, y Unión Internacional para la Conservación de la Naturaleza, Lista Roja de especies amenazadas."
70,EN.FSH.THRD.NO,"Especies de peces, en peligro","Las especies de peces se toman de la base de datos de R. Froese y D. Pauly (eds.). 2008. Las especies en peligro de extinción son las que la UICN clasifica como amenazadas, vulnerables, exóticas, indeterminadas, fuera de peligro o no suficientemente conocidas.","Froese, R. and Pauly, D. (eds). 2008. Base de datos de FishBase, www.fishbase.org."
71,EN.CO2.TRAN.ZS,Emisiones de CO2 originadas por el transporte (% del total de la quema de combustible),"Las emisiones de CO2 originadas por el transporte comprenden las emisiones de la quema de combustible de todas las actividades de transporte, independiente del sector, excepto los búnkers marítimos y la aviación internacional. Comprende la aviación nacional; la navegación nacional, y el transporte terrestre, ferroviario y productos y corresponde a la Categoría de fuente/sumidero 1 A 3 del IPCC. Además, los datos de la AIE no se recopilan de manera de permitir la separación del consumo de autoproductores por uso final especfico. Por lo tanto, los autoproductores se muestran en un templete separado (Autoproductores sin asignar).","Estadsticas AIE © OCDE/AIE, (http://www.iea.org/stats/index.asp), archivos electrnicos de la Agencia Internacional de la Energa sobre emisiones de CO2 originadas por la quema de combustible."
72,EN.CO2.OTHX.ZS,"Emisiones de CO2 originadas por otros sectores, no incluye edificios residenciales y servicios comerciales y pblicos (% del total de la quema de combustible)","Las emisiones de CO2 originadas por otros sectores, salvo los edificios residenciales y servicios comerciales y públicos, consideran las emisiones originadas por actividades comerciales/institucionales, residenciales, agrícolas/forestales, pesca y otras emisiones no especificadas en otra parte que se incluyen en las Categorías de fuente/sumidero 1 A 4 y 1 A 5 del IPCC. En las Directrices del IPCC de 1996, la categoría también incluía las emisiones de autoproductores del sector comercial, residencial y agrícola que generan electricidad y/o calefacción. Los datos de la AIE no se recopilan de manera de permitir la separacin del consumo de energa segn uso final especfico. Por lo tanto, los autoproductores se muestran en un templete separado (Autoproductores sin asignar).","Estadsticas AIE © OCDE/AIE, (http://www.iea.org/stats/index.asp), archivos electrnicos de la Agencia Internacional de la Energa sobre emisiones de CO2 originadas por la quema de combustible."
73,EN.CO2.MANF.ZS,Emisiones de CO2 originadas por la industria manufacturera y la construccin (% del total de la quema de combustible),"Las emisiones de CO2 originadas por la industria manufacturera y la construcción incluyen emisiones de la quema de combustible en la industria. La Categoría de fuente/sumidero 1 A 2 del IPCC incluye estas emisiones. Sin embargo, en las Directrices del IPCC de 1996 la categoría del IPCC también incluye las emisiones de autoproductores industriales que generan electricidad y/o calefacción. Los datos de la AIE no se recopilan de manera de permitir la separación del consumo de energía según uso final especfico. Por lo tanto, los autoproductores se muestran en un templete separado (Autoproductores sin asignar). La industria manufacturera y la construcción también incluyen emisiones de insumos de coque en altos hornos, lo que se puede informar ya sea en el sector de transformación, el sector industrial, o en la Categoría de fuente/sumidero 2 del IPCC, Procesos industriales.","Estadsticas AIE © OCDE/AIE, (http://www.iea.org/stats/index.asp), archivos electrnicos de la Agencia Internacional de la Energa sobre emisiones de CO2 originadas por la quema de combustible."
74,EN.CO2.ETOT.ZS,"Emisiones de CO2 originadas por la produccin de electricidad y calefaccin, total (% del total de la quema de combustible)","Emisiones de CO2 de la producción de electricidad y calefacción es la suma de tres categorías de emisiones de CO2 según el Organismo Internacional de Energía (OIE): 1) Servicios públicos de electricidad y calefacción contiene la suma de las emisiones provenientes de la generación de electricidad por parte del servicio, la generación combinada de calefacción y energía y las plantas de calefacción. Los servicios públicos (anteriormente conocidos como servicios de utilidad pública) se definen como aquellos cuya actividad principal es abastecer al público.  Pueden ser de propiedad pública o privada. Esto corresponde a la categoría de fuente/sumidero 1 A 1 del Grupo Intergubernamental de Expertos sobre el Cambio Climático (IPCC, por sus siglas en inglés). Para el documento (resumen) de las emisiones de CO2 de la combustión de combustibles, también se incluyen las emisiones del uso propio de combustible en el lugar en las centrales eléctricas (EPOWERPLT). 2) Autoproductores no asignados contiene las emisiones provenientes de la generación de electricidad y/o calefacción por autoproductores. Los autoproductores se definen como empresas que generan electricidad y/o calefacción para su propio uso como una actividad secundaria y que se utiliza (total o parcialmente) para respaldar su actividad principal. Pueden ser de propiedad pública o privada. En las Directrices 1996 del IPCC, estas emisiones se distribuyen normalmente entre los sectores de la industria, el transporte y ""otros"". 3) Otras industrias de energía contiene las emisiones del combustible quemado en las refinerías de petróleo, para la fabricación de combustibles sólidos, la minería del carbón, la extracción de petróleo y gas y otras industrias productoras de energía. Esto corresponde a las categorías de fuente/sumidero 1 A 1 b y 1 A 1 c de IPCC. Según las Directrices 1996 del IPCC, las emisiones de las entradas de coque a los altos hornos se pueden contar aquí o en la categoría de fuente/sumidero de los procesos industriales. Dentro de los cálculos detallados del sector, se pueden distinguir ciertos procesos no energéticos. En la reducción de hierro en altos hornos mediante la combustión de coque, el objetivo principal de la oxidación de coque es la producción de lingotes y las emisiones pueden considerarse un proceso industrial. Se debe tener cuidado de no contar doble estas emisiones en los procesos energéticos e industriales. En las estimaciones del OIE, estas emisiones se incluyeron en esta categoría.","Estadsticas AIE © OCDE/AIE, (http://www.iea.org/stats/index.asp), archivos electrnicos de la Agencia Internacional de la Energa sobre emisiones de CO2 originadas por la quema de combustible."
75,EN.CO2.BLDG.ZS,Emisiones de CO2 originadas por edificios residenciales y servicios comerciales y pblicos (% del total de la quema de combustible),"Emisiones de CO2 originadas por edificios residenciales y servicios comerciales y públicos consideran todas las emisiones de la quema de combustible en los hogares. Esto corresponde a categoría de fuente/sumidero 1 A 4 b del IPCC. Servicios comerciales y públicos incluyen emisiones de todas las actividades de las Divisiones 41, 50-52, 55, 63-67, 70-75, 80, 85, 90-93 y 99 de CIIU.","Estadsticas AIE © OCDE/AIE, (http://www.iea.org/stats/index.asp), archivos electrnicos de la Agencia Internacional de la Energa sobre emisiones de CO2 originadas por la quema de combustible."
76,EN.CLC.MDAT.ZS,"Sequías, inundaciones, temperaturas extremas (% de la población, promedio de 1990-2009)","Sequías, inundaciones y temperaturas extremas es el porcentaje promedio anual de población que se ve afectada por los desastres naturales clasificados como sequías, inundaciones o episodios de temperaturas extremas.  La sequía es un período prolongado de tiempo caracterizado por una deficiencia en el suministro de agua de una región como resultado de constantes precipitaciones por debajo del promedio. Una sequía puede provocar pérdidas a la agricultura, afecta la navegación interior y las centrales hidroeléctricas y provoca falta de agua potable y hambrunas. Una inundación es un aumento significativo del nivel de agua en un arroyo, lago, embalse o región costera. Episodios de temperatura extrema son las olas de frío o calor. Una ola de frío puede ser un período prolongado de tiempo excesivamente frío y la súbita invasión de aire muy frío sobre una zona extensa. Junto con las heladas, puede causar daños a la agricultura, la infraestructura y la propiedad.  Una ola de calor es un período prolongado de tiempo excesivamente cálido y a veces también húmedo, en relación con los patrones de clima normal de una región determinada. Población afectada es el número de personas heridas, que se quedaron sin hogar o que requieren asistencia inmediata durante un período de emergencia a causa de un desastre natural. También puede incluir a las personas desplazadas o evacuadas. El porcentaje promedio de población afectada se calcula dividiendo la suma del total de afectados en el período consignado por la suma de las cifras anuales de población para el lapso indicado.","EM-DAT: Base de datos internacionales sobre desastres de OFDA/CRED: www.emdat.be, Universidad Católica de Louvain, Bruselas (Bélgica) y Banco Mundial."
77,EN.CLC.GHGR.MT.CE,Emisiones y absorciones netas de GEI por cambio en los usos de la tierra y la silvicultura (toneladas métricas de equivalente de CO2).,"Emisiones y absorciones netas de GEI por cambio en los usos de la tierra y la silvicultura se refiere a los cambios en los niveles atmosféricos de todos los gases de efecto invernadero atribuibles a actividades de cambio en el uso de los bosques y la tierra, incluyendo pero no limitado a: 1) las emisiones y absorciones de CO2 de los aumentos o disminuciones en las existencias de biomasa debido a gestión de los bosques, explotación forestal, recolección de leña, etc., 2) la conversión de los bosques y los pastizales naturales a otros usos del suelo, 3) la absorción de CO2 a partir del abandono de tierras antes administradas (por ejemplo, tierras de cultivo y pastizales), y 4) las emisiones y la absorción de CO2 en el suelo asociadas con el cambio de uso y la gestión del suelo. Para países del Anexo I de la CMNUCC, estos datos se extraen de los inventarios anuales de GEI presentados en la CMNUCC por cada país; para países no incluidos en el Anexo I, los datos se extraen de la comunicación nacional más reciente presentada, siempre que se disponga de ella.  Debido a las diferencias en la información de años y metodologías, estos datos no se consideran generalmente comparables entre los países. Los datos se presentan en millones de toneladas métricas. ",Convención Marco de las Naciones Unidas sobre el Cambio Climático.
78,EN.CLC.DRSK.XQ,Puntuación del progreso en la reducción de los riesgos de desastres (escala de 1 a 5, 5= óptima),"Puntuación del progreso en la reducción de los riesgos de desastres es un promedio de calificaciones de autoevaluación, que van de 1 a 5, presentadas por los países en el marco de Prioridad 1 de los Informes nacionales de avance en la implementación del Marco de Acción de Hyogo.  El Marco de Hyogo es un plan mundial para los esfuerzos de reducción de los riesgos de desastres que fue adoptado por 168 países en 2005. Las evaluaciones de ""Prioridad 1"" incluyen cuatro indicadores que reflejan el grado en que los países han dado prioridad a la reducción del riesgo de desastres y el fortalecimiento de las instituciones pertinentes."
79,EN.BIR.THRD.NO,Especies de aves en peligro,"Por cada país incluido, las aves se enumeran dentro de las zonas de cría o invernada. Las especies en peligro de extinción son las que la UICN clasifica como amenazadas, vulnerables, exóticas, indeterminadas, fuera de peligro o no suficientemente conocidas.","Programa de las Naciones Unidas para el Medio Ambiente y Centro Mundial de Vigilancia de la Conservación, y Unión Internacional para la Conservación de la Naturaleza, Lista Roja de especies amenazadas."
80,EN.ATM.SF6G.KT.CE,Emisiones de gas SF6 (miles de toneladas métricas de equivalente de CO2),El hexafluoruro de sulfuro es muy utilizado para aislar el equipamiento eléctrico de alto voltaje.,"Comisión Europea, Centro Común de Investigación (JRC)/Agencia de Evaluación Ambiental de los Países Bajos (PBL). Base de Datos de Emisiones para la Investigación Atmosférica Global (EDGAR): http://edgar.jrc.ec.europa.eu/."
81,EN.ATM.PM25.MC.ZS,"Contaminación del aire por PM2,5, población expuesta a niveles que exceden el valor indicativo de la Organización Mundial de la Salud (OMS) (% del total)","Percent of population exposed to ambient concentrations of PM2.5 that exceed the WHO guideline value is defined as the portion of a country’s population living in places where mean annual concentrations of PM2.5 are greater than 10 micrograms per cubic meter, the guideline value recommended by the World Health Organization as the lower end of the range of concentrations over which adverse health effects due to PM2.5 exposure have been observed.","Brauer, M. et al. 2016, para el Estudio sobre la Carga Mundial de Morbilidad 2015."
82,EN.ATM.PM25.MC.M3,"Contaminación del aire por PM2,5, exposición anual media (microgramos por metro cúbico)","Population-weighted exposure to ambient PM2.5 pollution is defined as the average level of exposure of a nation's population to concentrations of suspended particles measuring less than 2.5 microns in aerodynamic diameter, which are capable of penetrating deep into the respiratory tract and causing severe health damage. Exposure is calculated by weighting mean annual concentrations of PM2.5 by population in both urban and rural areas.","Brauer, M. et al. 2016, para el Estudio sobre la Carga Mundial de Morbilidad 2015."
83,EN.ATM.PFCG.KT.CE,Emisiones de gas PFC (miles de toneladas métricas de equivalente de CO2),"Los perfluorocarbonos, usados para reemplazar los clorofluorocarbonos en la fabricación de semiconductores, son un subproducto de la fundición del aluminio y del enriquecimiento del uranio.","Comisión Europea, Centro Común de Investigación (JRC)/Agencia de Evaluación Ambiental de los Países Bajos (PBL). Base de Datos de Emisiones para la Investigación Atmosférica Global (EDGAR): http://edgar.jrc.ec.europa.eu/."
84,EN.ATM.NOXE.ZG,Emisiones de óxido nitroso (% de cambio desde 1990),"Nitrous oxide emissions are emissions from agricultural biomass burning, industrial activities, and livestock management. Each year of data shows the percentage change to that year from 1990.","Estimaciones del personal del Banco Mundial a partir de la fuente original: Comisión Europea, Centro Común de Investigación (JRC)/Agencia de Evaluación Ambiental de los Países Bajos (PBL). Base de Datos de Emisiones para la Investigación Atmosférica Global (EDGAR): http://edgar.jrc.ec.europa.eu/."
85,EN.ATM.NOXE.KT.CE,Emisiones de óxido nitroso (miles de toneladas métricas de equivalente de CO2),"Las emisiones de óxido nitroso son las generadas por la quema de biomasa en la agricultura, las actividades industriales y la cría de animales.","Comisión Europea, Centro Común de Investigación (JRC)/Agencia de Evaluación Ambiental de los Países Bajos (PBL). Base de Datos de Emisiones para la Investigación Atmosférica Global (EDGAR): http://edgar.jrc.ec.europa.eu/."
86,EN.ATM.NOXE.EG.ZS,Emisiones de óxido nitroso en el sector de energía (% del total),Nitrous oxide emissions from energy processes are emissions produced by the combustion of fossil fuels and biofuels.,"Estimaciones del personal del Banco Mundial a partir de la fuente original: Comisión Europea, Centro Común de Investigación (JRC)/Agencia de Evaluación Ambiental de los Países Bajos (PBL). Base de Datos de Emisiones para la Investigación Atmosférica Global (EDGAR): http://edgar.jrc.ec.europa.eu/."
87,EN.ATM.NOXE.EG.KT.CE,Emisiones de óxido nitroso en el sector de energía (miles de toneladas métricas de equivalente de CO2),Las emisiones de óxido nitroso de los procesos energéticos son emisiones producidas por la combustión de combustibles fósiles y biocombustibles.,"Comisión Europea, Centro Común de Investigación (JRC)/Agencia de Evaluación Ambiental de los Países Bajos (PBL). Base de Datos de Emisiones para la Investigación Atmosférica Global (EDGAR): http://edgar.jrc.ec.europa.eu/."
88,EN.ATM.NOXE.AG.ZS,Emisiones de óxido nitroso procedentes de la actividad agrícola (% del total),"Emisiones de óxido nitroso procedentes de la actividad agrícola son las originadas por el uso de fertilizantes (abono sintético y animal), el tratamiento de desechos animales, la quema de residuos agrícolas (no energéticos, in situ) y la quema de sabanas.","Estimaciones del personal del Banco Mundial a partir de la fuente original: Comisión Europea, Centro Común de Investigación (JRC)/Agencia de Evaluación Ambiental de los Países Bajos (PBL). Base de Datos de Emisiones para la Investigación Atmosférica Global (EDGAR): http://edgar.jrc.ec.europa.eu/."
89,EN.ATM.NOXE.AG.KT.CE,Emisiones agrícolas de óxido nitroso (miles de toneladas métricas de equivalente de CO2),"Emisiones de óxido nitroso procedentes de la actividad agrícola son las originadas por el uso de fertilizantes (abono sintético y animal), el tratamiento de desechos animales, la quema de residuos agrícolas (no energéticos, in situ) y la quema de sabanas.","Comisión Europea, Centro Común de Investigación (JRC)/Agencia de Evaluación Ambiental de los Países Bajos (PBL). Base de Datos de Emisiones para la Investigación Atmosférica Global (EDGAR): http://edgar.jrc.ec.europa.eu/."
90,EN.ATM.METH.ZG,Emisiones de metano (% de cambio desde 1990),Methane emissions are those stemming from human activities such as agriculture and from industrial methane production. Each year of data shows the percentage change to that year from 1990.,"Estimaciones del personal del Banco Mundial a partir de la fuente original: Comisión Europea, Centro Común de Investigación (JRC)/Agencia de Evaluación Ambiental de los Países Bajos (PBL). Base de Datos de Emisiones para la Investigación Atmosférica Global (EDGAR): http://edgar.jrc.ec.europa.eu/."
91,EN.ATM.METH.KT.CE,Emisiones de metano (kt de equivalente de CO2),Las emisiones de metano son las que surgen de actividades humanas como la agricultura y de la producción industrial de metano.,"Comisión Europea, Centro Común de Investigación (JRC)/Agencia de Evaluación Ambiental de los Países Bajos (PBL). Base de Datos de Emisiones para la Investigación Atmosférica Global (EDGAR): http://edgar.jrc.ec.europa.eu/."
92,EN.ATM.METH.EG.ZS,Emisiones de metano relacionadas con la energía (% del total),"Las emisiones de gas metano provenientes de procesos energéticos son emisiones de la producción, manejo, transmisión y combustión de combustibles fósiles y biocombustibles.","Estimaciones del personal del Banco Mundial a partir de la fuente original: Comisión Europea, Centro Común de Investigación (JRC)/Agencia de Evaluación Ambiental de los Países Bajos (PBL). Base de Datos de Emisiones para la Investigación Atmosférica Global (EDGAR): http://edgar.jrc.ec.europa.eu/."
93,EN.ATM.METH.EG.KT.CE,Emisiones de metano en el sector de energía (miles de toneladas métricas de equivalente de CO2),"Las emisiones de gas metano provenientes de procesos energéticos son emisiones de la producción, manejo, transmisión y combustión de combustibles fósiles y biocombustibles.","Comisión Europea, Centro Común de Investigación (JRC)/Agencia de Evaluación Ambiental de los Países Bajos (PBL). Base de Datos de Emisiones para la Investigación Atmosférica Global (EDGAR): http://edgar.jrc.ec.europa.eu/."
